{"artifacts":[{"digest":"sha256:084c799cd551dd1d8d5c5f9a5d593b2e931f5e36122ee5c793c1d08a19839cc0","kind":"witness","path":"records/artifacts/sha256/084c799cd551dd1d8d5c5f9a5d593b2e931f5e36122ee5c793c1d08a19839cc0"}],"authentication":{"algorithm":"ed25519","identity_binding":{"actor_class":"agent","actor_id":"agent:independent-js","binding_id":"vib_2e85aeb82ac75615","created_at":"2026-07-27T12:00:00Z","public_key_hex":"03a107bff3ce10be1d70dd18e74bc09967e4d6309ba50d5f1ddc8664125531b8","schema":"vela.identity_binding.v0.1","signature":"4c398203b00782aa663dcaf4d80f909ccc534481edccdbfa3c8fb4070d6c1c5503641b9abd4307ef4884c0a3bd170a0750c84cc775e2ae0d2109cef8b0811f0e"},"signature":"d1e8630a6f6ae14cdcf8e0e370b4392faa77d59aaa87494469124a50de3ee84dea331485c3e7b485721ca0b921a17c78281ae32885ed62c12ed1437623223809"},"caveats":["This bounded fixture does not establish behavior for any other input."],"claim":{"assertion":"The fixture computation returns 42 for the pinned input.","conditions":["Input bytes equal sha256:aaaaaaaaaaaaaaaaaaaaaaaaaaaaaaaaaaaaaaaaaaaaaaaaaaaaaaaaaaaaaaaa."],"type":"computational"},"producer_checks":[{"authority":"producer_reported","method":"fixture arithmetic","outcome":"pass"}],"provenance":{"emitted_at":"2026-07-27T12:00:00Z","producer":"agent:independent-js","source_run":"fixture-run-001","source_system":"stdlib-node-reference"},"replayability":"exact","requested_change":{"kind":"add_claim"},"schema":"vela.submission.v1","submission_id":"vsb_8a36cdb336823499","verification_requirements":["Recompute the result from the exact fixture bytes."]}
